{
  "$schema": "../../../schema/vector.schema.json",
  "id": "wallet.brc100.isauthenticated",
  "name": "BRC-100 isauthenticated",
  "brc": [
    "BRC-100"
  ],
  "version": "2.0.0",
  "reference_impl": "@bsv/sdk@2.0.14 + wallet-toolbox",
  "parity_class": "required",
  "vectors": [
    {
      "id": "wallet.brc100.isauthenticated.1",
      "description": "isAuthenticated happy path",
      "input": {
        "args": {}
      },
      "expected": {
        "result": 123456
      },
      "tags": [
        "brc-100",
        "isAuthenticated"
      ]
    }
  ]
}